{
  "id": "xinhua_pet",
  "name": "新华人宠友好地图",
  "center": {
    "lat": 31.207107,
    "lng": 121.427568
  },
  "zoom": 15,
  "origin": "两条尾巴小程序",
  "filter": {
    "inclusive": {
      "类型": ["吃", "喝", "逛"],
      "环境": ["入座室内", "落座室外"]
    },
    "exclusive": {}
  },
  "data": [
    {
      "name": "8PINTS 八品脱 9又3/4餐厅(番禺路店)",
      "address": "番禺路390号LOPE390商场103室D区",
      "phone": "",
      "webName": "",
      "intro": "携宠可入座室内/落座室外，提供饮水盆。",
      "tags": ["吃", "入座室内", "落座室外", "饮水盆"],
      "center": {
        "lat": 31.20433,
        "lng": 121.42966
      }
    },
    {
      "name": "Alimentari Piccolo意大利餐吧&披萨(番禺路店)",
      "address": "番禺路390号103室A区",
      "phone": "",
      "webName": "",
      "intro": "携宠可落座室外，提供饮水盆。",
      "tags": ["吃", "落座室外", "饮水盆"],
      "center": {
        "lat": 31.20433,
        "lng": 121.42966
      }
    },
    {
      "name": "Bake No Title",
      "address": "番禺路232号",
      "phone": "",
      "webName": "",
      "intro": "携宠可入座室内，新华街道宠友推荐。",
      "tags": ["吃", "入座室内", "新华街道宠友推荐"],
      "center": {
        "lat": 31.206367,
        "lng": 121.429174
      }
    },
    {
      "name": "BAKER&SPICE(幸福里店)",
      "address": "番禺路381号6号楼D座102-103室",
      "phone": "",
      "webName": "",
      "intro": "携宠可落座室外。",
      "tags": ["吃", "落座室外"],
      "center": {
        "lat": 31.204398,
        "lng": 121.430455
      }
    },
    {
      "name": "Blac+Blac(金地新华道店)",
      "address": "番禺路222弄55号1层F106号",
      "phone": "",
      "webName": "",
      "intro": "携宠可落座室外。",
      "tags": ["吃", "落座室外"],
      "center": {
        "lat": 31.206917,
        "lng": 121.428954
      }
    },
    {
      "name": "Cash IN咖啡小酒馆(番禺路店)",
      "address": "番禺路390号LOPE390一楼",
      "phone": "",
      "webName": "",
      "intro": "携宠可落座室外。",
      "tags": ["吃", "落座室外"],
      "center": {
        "lat": 31.20433,
        "lng": 121.42966
      }
    },
    {
      "name": "Cotton's棉花园西餐厅(上海新华路店)",
      "address": "新华路294弄1号",
      "phone": "",
      "webName": "",
      "intro": "携宠可入座室内/落座室外，提供饮水盆。",
      "tags": ["吃", "入座室内", "落座室外", "饮水盆"],
      "center": {
        "lat": 31.203336,
        "lng": 121.427051
      }
    },
    {
      "name": "El Bodegon阿根廷秘鲁餐厅(番禺路店)",
      "address": "番禺路326号(甲)2楼",
      "phone": "",
      "webName": "",
      "intro": "携宠可入座室内，提供饮水盆、拾便袋。",
      "tags": ["吃", "入座室内", "饮水盆", "拾便袋"],
      "center": {
        "lat": 31.204475,
        "lng": 121.429424
      }
    },
    {
      "name": "HOLY BAGEL(幸福里店)",
      "address": "幸福路幸福里E座107号",
      "phone": "",
      "webName": "",
      "intro": "携宠可入座室内/落座室外，提供饮水盆，新华街道宠友推荐。",
      "tags": ["吃", "入座室内", "落座室外", "饮水盆", "宠友推荐"],
      "center": {
        "lat": 31.204398,
        "lng": 121.430455
      }
    },
    {
      "name": "NICK RHINO尼克犀牛西安小酒馆",
      "address": "平武路38号105",
      "phone": "",
      "webName": "",
      "intro": "携宠可入座室内/落座室外，提供饮水盆，新华街道宠友推荐。",
      "tags": ["吃", "入座室内", "落座室外", "饮水盆", "宠友推荐"],
      "center": {
        "lat": 31.20854,
        "lng": 121.43043
      }
    },
    {
      "name": "O'mills Light Brunch&Bistro(幸福里店)",
      "address": "番禺路381号E座108号",
      "phone": "",
      "webName": "",
      "intro": "携宠可落座室外，提供饮水盆。",
      "tags": ["吃", "落座室外", "饮水盆"],
      "center": {
        "lat": 31.204398,
        "lng": 121.430455
      }
    },
    {
      "name": "OHO活好byMIG",
      "address": "新华路412号",
      "phone": "",
      "webName": "",
      "intro": "携宠可入座室内/落座室外，提供饮水盆，新华街道宠友推荐。",
      "tags": ["吃", "入座室内", "落座室外", "饮水盆", "宠友推荐"],
      "center": {
        "lat": 31.203924,
        "lng": 121.424749
      }
    },
    {
      "name": "PAIN CHAUD百丘(番禺路店)",
      "address": "番禺路483号1层A1室",
      "phone": "",
      "webName": "",
      "intro": "携宠可落座室外，提供饮水盆、拾便袋。",
      "tags": ["吃", "落座室外", "饮水盆", "拾便袋"],
      "center": {
        "lat": 31.202871,
        "lng": 121.430477
      }
    },
    {
      "name": "Pie Society派社(幸福店)",
      "address": "番禺路381号幸福里B座102室",
      "phone": "",
      "webName": "",
      "intro": "携宠可入座室内/落座室外，新华街道宠友推荐。",
      "tags": ["吃", "入座室内", "落座室外", "宠友推荐"],
      "center": {
        "lat": 31.204398,
        "lng": 121.430455
      }
    },
    {
      "name": "POPUP by BNT",
      "address": "番禺路232号",
      "phone": "",
      "webName": "",
      "intro": "携宠可入座室内。",
      "tags": ["吃", "入座室内"],
      "center": {
        "lat": 31.206367,
        "lng": 121.429174
      }
    },
    {
      "name": "SITE TASTE&FOOD(新华路店)",
      "address": "新华路365弄6号楼101B",
      "phone": "",
      "webName": "",
      "intro": "携宠可落座室外，仅允许中小型犬，提供饮水盆。",
      "tags": ["吃", "落座室外", "仅允许中小型犬", "饮水盆"],
      "center": {
        "lat": 31.202607,
        "lng": 121.425258
      }
    },
    {
      "name": "SnailTapas蜗牛西班牙餐厅",
      "address": "番禺路381号幸福里文化创意园B座105号",
      "phone": "",
      "webName": "",
      "intro": "携宠可落座室外，提供饮水盆。",
      "tags": ["吃", "落座室外", "饮水盆"],
      "center": {
        "lat": 31.204398,
        "lng": 121.430455
      }
    },
    {
      "name": "ura",
      "address": "番禺路232号",
      "phone": "",
      "webName": "",
      "intro": "携宠可落座室外。",
      "tags": ["吃", "落座室外"],
      "center": {
        "lat": 31.206367,
        "lng": 121.429174
      }
    },
    {
      "name": "Villa Le Bec321",
      "address": "新华路321号",
      "phone": "",
      "webName": "",
      "intro": "携宠可入座室内/落座室外，提供饮水盆。",
      "tags": ["吃", "入座室内", "落座室外", "饮水盆"],
      "center": {
        "lat": 31.203028,
        "lng": 121.426539
      }
    },
    {
      "name": "Yakitapa·炭烤西班牙融合餐厅(金地新华道店)",
      "address": "番禺路222弄55号一层沿街F1-107号",
      "phone": "",
      "webName": "",
      "intro": "携宠可入座室内，新华街道宠友推荐。",
      "tags": ["吃", "入座室内", "宠友推荐"],
      "center": {
        "lat": 31.206917,
        "lng": 121.428954
      }
    },
    {
      "name": "煲山海·粤式煲仔排档(新华路店)",
      "address": "新华路660号B栋1层",
      "phone": "",
      "webName": "",
      "intro": "携宠可入座室内/落座室外，提供饮水盆。",
      "tags": ["吃", "入座室内", "落座室外", "饮水盆"],
      "center": {
        "lat": 31.205344,
        "lng": 121.42061
      }
    },
    {
      "name": "陈记贵州遵义羊肉粉·酸汤鱼(法华镇路店)",
      "address": "新华路660号B栋1层",
      "phone": "",
      "webName": "",
      "intro": "携宠可入座室内，新华街道宠友推荐。",
      "tags": ["吃", "入座室内", "宠友推荐"],
      "center": {
        "lat": 31.205344,
        "lng": 121.42061
      }
    },
    {
      "name": "大西北牛肉面(幸福路店)",
      "address": "幸福路13号1室",
      "phone": "",
      "webName": "",
      "intro": "携宠可入座室内，新华街道宠友推荐。",
      "tags": ["吃", "入座室内", "宠友推荐"],
      "center": {
        "lat": 31.203914,
        "lng": 121.430612
      }
    },
    {
      "name": "贰粉之壹·宁波海鲜米粉",
      "address": "法华镇路680号",
      "phone": "",
      "webName": "",
      "intro": "携宠可入座室内，新华街道宠友推荐。",
      "tags": ["吃", "入座室内", "宠友推荐"],
      "center": {
        "lat": 31.206006,
        "lng": 121.422178
      }
    },
    {
      "name": "黄建国大饭店(金地新华道店)",
      "address": "番禺路222弄55号金地新华道1楼F113",
      "phone": "",
      "webName": "",
      "intro": "携宠可入座室内/落座室外，提供饮水盆、拾便袋、尿垫，新华街道宠友推荐。",
      "tags": [
        "吃",
        "入座室内",
        "落座室外",
        "饮水盆",
        "拾便袋",
        "尿垫",
        "宠友推荐"
      ],
      "center": {
        "lat": 31.207765,
        "lng": 121.426684
      }
    },
    {
      "name": "沪味小馆·本帮菜(凯旋路店)",
      "address": "凯旋路1295号1层3室",
      "phone": "",
      "webName": "",
      "intro": "携宠可入座室内，仅允许中小型犬。",
      "tags": ["吃", "入座室内", "仅允许中小型犬"],
      "center": {
        "lat": 31.202596,
        "lng": 121.419236
      }
    },
    {
      "name": "沪西老弄堂面馆(定西路店)",
      "address": "定西路685号101",
      "phone": "",
      "webName": "",
      "intro": "携宠可落座室外。",
      "tags": ["吃", "落座室外"],
      "center": {
        "lat": 31.206819,
        "lng": 121.423532
      }
    },
    {
      "name": "六樘门川面(新华路店)",
      "address": "新华路419号-1",
      "phone": "",
      "webName": "",
      "intro": "携宠可入座室内，新华街道宠友推荐。",
      "tags": ["吃", "入座室内", "宠友推荐"],
      "center": {
        "lat": 31.2036,
        "lng": 121.4248
      }
    },
    {
      "name": "礼好·猴哒喇台菜酒馆LIHO·HODALABistro",
      "address": "番禺路390号2楼",
      "phone": "",
      "webName": "",
      "intro": "携宠可入座室内。",
      "tags": ["吃", "入座室内"],
      "center": {
        "lat": 31.20433,
        "lng": 121.42966
      }
    },
    {
      "name": "毛頭老爹飯店(幸福里店)",
      "address": "番禺路326号",
      "phone": "",
      "webName": "",
      "intro": "携宠可入座室内。",
      "tags": ["吃", "入座室内"],
      "center": {
        "lat": 31.204504,
        "lng": 121.429451
      }
    },
    {
      "name": "玫瑰厅上海菜(兴国路店)",
      "address": "兴国路372弄1号101",
      "phone": "",
      "webName": "",
      "intro": "携宠可落座室外，提供饮水盆。",
      "tags": ["吃", "落座室外", "饮水盆"],
      "center": {
        "lat": 31.205175,
        "lng": 121.437321
      }
    },
    {
      "name": "秘密花园(法华镇路店)",
      "address": "法华镇路525号创意树林入口处",
      "phone": "",
      "webName": "",
      "intro": "携宠可落座室外，提供饮水盆，新华街道宠友推荐。",
      "tags": ["吃", "落座室外", "饮水盆", "宠友推荐"],
      "center": {
        "lat": 31.205183,
        "lng": 121.425531
      }
    },
    {
      "name": "鸟屋·烧鸟串烧居酒屋(番禺路店)",
      "address": "番禺路390号",
      "phone": "",
      "webName": "",
      "intro": "携宠可落座室外。",
      "tags": ["吃", "落座室外"],
      "center": {
        "lat": 31.20433,
        "lng": 121.42966
      }
    },
    {
      "name": "平田拉面(香花桥路)",
      "address": "香花桥路31号",
      "phone": "",
      "webName": "",
      "intro": "携宠可入座室内，仅允许中小型犬，新华街道宠友推荐。",
      "tags": ["吃", "入座室内", "仅允许中小型犬", "宠友推荐"],
      "center": {
        "lat": 31.204132,
        "lng": 121.425587
      }
    },
    {
      "name": "大吉烧鸟专门店·拉面食堂·居酒屋(番禺路店)",
      "address": "番禺路390号1楼沿街",
      "phone": "",
      "webName": "",
      "intro": "携宠可入座室内/落座室外。",
      "tags": ["吃", "入座室内", "落座室外"],
      "center": {
        "lat": 31.20433,
        "lng": 121.42966
      }
    },
    {
      "name": "淑芬串串公司·火锅串串香(中山公园店)",
      "address": "定西路1216号",